'Mind-boggling': How pandemic planning never accounted for a President like Trump,CNN,https://www.cnn.com/2020/04/14/politics/pandemic-preparedness-trump-invs/index.html,2020-04-15
Why the New York Times coronavirus story makes Trump so angry,CNN,https://www.cnn.com/2020/04/14/politics/trump-new-york-times-coronavirus/index.html,2020-04-15
Cuomo says he would refuse and challenge an order from Trump to reopen New York's economy if it put residents' health at risk,CNN,https://www.cnn.com/2020/04/14/politics/andrew-cuomo-donald-trump-reopen-new-york-economy-coronavirus-cnntv/index.html,2020-04-14
Trump rages at criticism while governors craft their own plans to reopen the economy,CNN,https://www.cnn.com/2020/04/14/politics/donald-trump-coronavirus-governors-economy/index.html,2020-04-14
Connecticut governor says not to be distracted by 'verbal hand grenades' from Trump,CNN,https://www.cnn.com/2020/04/14/politics/ned-lamont-trump-coronavirus-cnntv/index.html,2020-04-14
Fact check: A list of false claims from Trump's bitter coronavirus briefing,CNN,https://www.cnn.com/2020/04/13/politics/fact-check-coronavirus-briefing-april-13/index.html,2020-04-14
Trump's favorite scapegoat emerges as his best ally in US economic rescue effort,CNN,https://www.cnn.com/2020/04/13/politics/jerome-powell-federal-reserve-us-economy-trump/index.html,2020-04-14
Hand sanitizer makers ask Trump for China tariff relief amid shortages,CNN,https://www.cnn.com/2020/04/13/politics/trade-china-tariffs-hand-sanitizer-covid/index.html,2020-04-14
Trump says he will ask for a delay to the 2020 Census,CNN,https://www.cnn.com/2020/04/13/politics/census-trump-coronavirus/index.html,2020-04-14
Trump retweets call to fire Fauci amid coronavirus criticism,CNN,https://www.cnn.com/2020/04/13/politics/donald-trump-anthony-fauci-tweet/index.html,2020-04-13
What a disaster that would be for Trump and the US,CNN,https://www.cnn.com/2020/04/13/opinions/firing-fauci-disaster-for-trump-americans-dantonio/index.html,2020-04-13
"Supreme Court to hear cases on Trump's financial docs, religious freedom and Electoral College via telephone",CNN,https://www.cnn.com/2020/04/13/politics/supreme-court-cases-teleconference/index.html,2020-04-13
The world's fragmented coronavirus response suits Trump just fine,CNN,https://www.cnn.com/2020/04/12/world/meanwhile-in-america-april-10-intl/index.html,2020-04-12
Good news on coronavirus makes it harder for Trump to hold the line,CNN,https://www.cnn.com/2020/04/12/politics/social-distancing-us-economy-covid-politics/index.html,2020-04-12
Trump suggests hydroxychloroquine may protect against Covid-19.,CNN,https://www.cnn.com/2020/04/05/health/trump-lupus-hydroxychloroquine-coronavirus-protection/index.html,2020-04-11
Trump tells faith leaders to let the country 'get healed' before holding in-person services,CNN,https://www.cnn.com/2020/04/10/politics/donald-trump-easter-healing-coronavirus/index.html,2020-04-10
CNN Poll of Polls: Trump's approval ticking down on coronavirus response,CNN,https://www.cnn.com/2020/04/10/politics/cnn-poll-of-polls-trump-approval-coronavirus-general-election-biden/index.html,2020-04-10
What the Wall Street Journal Editorial Board gets exactly right about Trump's problematic coronavirus briefings,CNN,https://www.cnn.com/2020/04/10/politics/wall-street-journal-trump-coronavirus-task-force/index.html,2020-04-10
Trump administration is rushing to gut environmental protections,CNN,https://www.cnn.com/2020/04/10/opinions/trump-rushing-to-rollback-environmental-protections-during-pandemic-garbow/index.html,2020-04-10
Barr defends Trump's firing of intel community watchdog as the 'right thing' to do,CNN,https://www.cnn.com/2020/04/10/politics/william-barr-john-durham-russia-investigation/index.html,2020-04-10
Lack of coronavirus testing may blunt Trump's planned economic revival,CNN,https://www.cnn.com/2020/04/10/politics/donald-trump-testing-economy-coronavirus/index.html,2020-04-10
"Fact check: Trump lies about voter fraud while states, CDC encourage voting-by-mail as pandemic-friendly option",CNN,https://www.cnn.com/2020/04/10/politics/fact-check-trump-lying-voter-fraud/index.html,2020-04-10
Sweden challenges Trump -- and scientific mainstream -- by refusing to lock down,CNN,https://www.cnn.com/2020/04/10/europe/sweden-lockdown-turmp-intl/index.html,2020-04-10
GOP aligns with Trump in vote-by-mail clash looming over next relief package,CNN,https://www.cnn.com/2020/04/09/politics/mail-vote-fight-congress/index.html,2020-04-10
Disastrous jobs data sharpens Trump's dilemma over closed economy,CNN,https://www.cnn.com/2020/04/09/politics/donald-trump-economy-joe-biden-coronavirus/index.html,2020-04-09
Donald Trump's secret theory about Barack Obama's endorsement,CNN,https://www.cnn.com/2020/04/09/politics/barack-obama-joe-biden-donald-trump/index.html,2020-04-09
Fact check: Trump offers two dangerous falsehoods in a largely straightforward briefing,CNN,https://www.cnn.com/2020/04/08/politics/fact-check-trump-coronavirus-briefing-april-8/index.html,2020-04-09
Trump preparing to announce second task force focused on economic recovery,CNN,https://www.cnn.com/2020/04/09/politics/trump-economy-task-force/index.html,2020-04-09
Colorado Democrat believes Trump awarded ventilators as political favor to vulnerable GOP senator,CNN,https://www.cnn.com/2020/04/08/politics/degette-gardner-trump-ventilators-favor/index.html,2020-04-09
WHO defends coronavirus response after Trump criticism,CNN,https://www.cnn.com/2020/04/08/politics/who-responds-trump-claims-coronavirus/index.html,2020-04-08
Aides hope to give Trump his economic 'big bang' starting in May,CNN,https://www.cnn.com/2020/04/08/politics/donald-trump-economy-big-bang-coronavirus/index.html,2020-04-08
The 24 most wildly irresponsible lines from Donald Trump's latest interview with Sean Hannity,CNN,https://www.cnn.com/2020/04/08/politics/donald-trump-sean-hannity-coronavirus/index.html,2020-04-08
CDC removes guidance on drugs touted by Trump to treat coronavirus,CNN,https://www.cnn.com/2020/04/08/health/cdc-coronavirus-hydroxychloroquine/index.html,2020-04-08
Democratic super PAC turns up focus on Trump's coronavirus response,CNN,https://www.cnn.com/2020/04/08/politics/priorities-usa-coronavirus-ads/index.html,2020-04-08
Chaos rocks Trump White House on virus' most tragic day,CNN,https://www.cnn.com/2020/04/08/politics/donald-trump-coronavirus/index.html,2020-04-08
"Fact check: Trump makes false claims about his coronavirus record and voter fraud, misleads about the WHO",CNN,https://www.cnn.com/2020/04/07/politics/fact-check-trump-coronavirus-briefing-april-7/index.html,2020-04-08
Trump is desperately seeking to avoid blame,CNN,https://www.cnn.com/2020/04/07/opinions/trump-covid-19-stimulus-glenn-fine-filipovic/index.html,2020-04-08
The Supreme Court is tipping the scales toward Trump's reelection,CNN,https://www.cnn.com/2020/04/07/opinions/supreme-court-tipping-scales-trump-reelection-psaki/index.html,2020-04-07
How Peter Navarro went from an anti-China 'gadfly' to trusted Trump coronavirus adviser,CNN,https://www.cnn.com/2020/04/07/politics/peter-navarro-coronavirus-white-house-china/index.html,2020-04-07
Fact check: Trump falsely claims he 'inherited' the faulty coronavirus test.,CNN,https://www.cnn.com/2020/04/07/politics/fact-check-trump-inherited-broken-obsolete-coronavirus-tests/index.html,2020-04-07
Trump removes independent watchdog tasked with overseeing coronavirus emergency funds,CNN,https://www.cnn.com/2020/04/07/politics/trump-sidelines-pentagon-watchdog-coronavirus-funds/index.html,2020-04-07
Why public approval of Trump's coronavirus response may not save him in November,CNN,https://www.cnn.com/2020/04/07/politics/2020-election-trump-approval-covid-pandemic/index.html,2020-04-07
"Fact Check: Trump baselessly disputes HHS IG report, repeats several other false claims at Monday's coronavirus briefing",CNN,https://www.cnn.com/2020/04/06/politics/fact-check-trump-coronavirus-briefing-april-6/index.html,2020-04-07
2020 is shaping up to be all about Trump,CNN,https://www.cnn.com/2020/04/07/politics/trump-2020-analysis/index.html,2020-04-07
Trump turns angry and defensive as evidence contradicts his coronavirus narrative,CNN,https://www.cnn.com/2020/04/06/politics/donald-trump-coronavirus-angry-defensive/index.html,2020-04-07
NYC official who lost his mother to coronavirus rips Trump's response to pandemic,CNN,https://www.cnn.com/2020/04/06/politics/scott-stringer-coronavirus-donald-trump-cnntv/index.html,2020-04-07
The coronavirus blame game: It's not just Trump,CNN,https://www.cnn.com/2020/04/06/opinions/coronavirus-blame-game-its-not-just-trump-stewart/index.html,2020-04-07
Trump approves New York request to treat coronavirus patients on Navy hospital ship,CNN,https://www.cnn.com/2020/04/06/politics/navy-hospital-ship-comfort-coronavirus-patients/index.html,2020-04-07
"Why Donald Trump's firing of the Intelligence Community IG is so, so egregious",CNN,https://www.cnn.com/2020/04/06/politics/michael-atkinson-firing/index.html,2020-04-06
How the Trump campaign is adjusting in the time of coronavirus,CNN,https://www.cnn.com/2020/04/06/politics/trump-campaign-coronavirus/index.html,2020-04-06
Trump doubles down on unproven drugs to treat and prevent coronavirus,CNN,https://www.cnn.com/2020/04/05/politics/coronavirus-hydroxychloroquine-trump-briefing/index.html,2020-04-06
Melania Trump stresses the importance of taking masks seriously,CNN,https://www.cnn.com/2020/04/05/politics/melania-trump-masks-coronavirus/index.html,2020-04-06
Washington governor slams Trump administration for comparing coronavirus' grim outlook to Pearl Harbor,CNN,https://www.cnn.com/2020/04/05/politics/washington-governor-inslee-pearl-harbor-coronavirus/index.html,2020-04-06
"Trump on USNS Comfort: 'If we need it for the virus, we'll use it for that'",CNN,https://www.cnn.com/2020/04/05/politics/trump-coronavirus-briefing/index.html,2020-04-05
How job losses could affect Trump and the 2020 election,CNN,https://www.cnn.com/2020/04/05/politics/trump-reelection-job-losses-analysis/index.html,2020-04-05
A timeline of Trump promises and predictions on coronavirus -- and how they stack up against the facts,CNN,https://www.cnn.com/2020/04/05/politics/timeline-trump-promises-coronavirus/index.html,2020-04-06
Donald Trump's supreme challenge,CNN,https://www.cnn.com/2020/04/05/opinions/donald-trumps-supreme-challenge-opinion-weekly-column-galant/index.html,2020-04-05
Trump's popularity bump may have already plateaued ahead of schedule,CNN,https://www.cnn.com/2020/04/05/politics/trump-approval-poll-of-the-week/index.html,2020-04-05
"US coronavirus death toll tops 8,000 as Trump warns 'there will be a lot of death'",CNN,https://www.cnn.com/2020/04/04/health/us-coronavirus-saturday/index.html,2020-04-05
READ: Trump's letter removing intelligence community inspector general,CNN,https://www.cnn.com/2020/04/03/politics/read-michael-atkinson-letter/index.html,2020-04-04
Trump administration edits national stockpile website a day after it contradicted Jared Kushner,CNN,https://www.cnn.com/2020/04/03/politics/stockpile-website-edited-kushner-claim/index.html,2020-04-06
Biden campaign says he backs Trump's China travel ban,CNN,https://www.cnn.com/2020/04/03/politics/joe-biden-trump-china-coronavirus/index.html,2020-04-03
The 11 wildest lines from Donald Trump's utterly childish letter to Chuck Schumer,CNN,https://www.cnn.com/2020/04/03/politics/chuck-schumer-donald-trump-letter-coronavirus/index.html,2020-04-03
Trump letter attacking Schumer is sent as President says 'this is not the time for politics',CNN,https://www.cnn.com/2020/04/02/politics/trump-schumer-letter-politics/index.html,2020-04-03
Delay in Trump's financial documents cases clouds House power on investigations,CNN,https://www.cnn.com/2020/04/03/politics/supreme-court-trump-documents-coronavirus/index.html,2020-04-03
"Fact-checking coronavirus briefing: Trump says scarves 'better' than masks, exaggerates Europe travel restriction",CNN,https://www.cnn.com/2020/04/02/politics/fact-check-trump-coronavirus-briefing-april-2/index.html,2020-04-06
Trump passes the buck as deadly ventilator shortage looms,CNN,https://www.cnn.com/2020/04/02/politics/donald-trump-ventilators-leadership-coronavirus/index.html,2020-04-03
"Trump again tests negative for coronavirus, White House says",CNN,https://www.cnn.com/2020/04/02/politics/trump-again-tests-negative-for-coronavirus/index.html,2020-04-02
Trump campaign sends letter to Sessions demanding he stop invoking Trump,CNN,https://www.cnn.com/2020/04/02/politics/donald-trump-jeff-sessions-letter/index.html,2020-04-02
"As tragic toll from virus rises, so do questions about Trump's leadership",CNN,https://www.cnn.com/2020/04/02/politics/donald-trump-coronavirus-leadership/index.html,2020-04-02
Trump threatens heavy price if Iran conducts 'sneak attack' on US troops,CNN,https://www.cnn.com/2020/04/01/politics/trump-iran-threat/index.html,2020-04-02
The dangerous disconnect between Trump's rhetoric and the reality for potential coronavirus treatments,CNN,https://www.cnn.com/2020/04/01/politics/trump-chloroquine-drugs-coronavirus-treatment/index.html,2020-04-01
Trump-aligned super PAC spending $10 million against Biden,CNN,https://www.cnn.com/2020/04/01/politics/america-first-action-trump-biden-ad-buy/index.html,2020-04-01
Why Donald Trump shouldn't get credit for (finally) realizing coronavirus is actually deadly serious,CNN,https://www.cnn.com/2020/04/01/politics/donald-trump-coronavirus-tragedy/index.html,2020-04-01
Trump's alarming message portends tragic days ahead,CNN,https://www.cnn.com/2020/03/31/politics/trump-coronavirus/index.html,2020-04-01
"Trump administration to roll back fuel efficiency standards, weakening efforts to combat climate crisis",CNN,https://www.cnn.com/2020/03/31/politics/trump-fuel-efficiency-standards/index.html,2020-03-31
History's verdict on Trump will be devastating,CNN,https://www.cnn.com/2020/03/30/opinions/history-verdict-on-trump-devastating-dantonio/index.html,2020-03-31
"Fact check: Trump again touts unproven drugs for coronavirus, and other misleading statements from Monday's briefing",CNN,https://www.cnn.com/2020/03/30/politics/fact-check-trump-coronavirus-briefing-march-30/index.html,2020-04-06
Meadows resigns from Congress to officially start work as Trump's chief of staff,CNN,https://www.cnn.com/2020/03/30/politics/mark-meadows-congress-trump-chief-of-staff/index.html,2020-03-31
Trump's coronavirus briefings matter whether or not he tells the truth,CNN,https://www.cnn.com/2020/03/30/politics/what-matters-trump-fact-fiction-coronavirus/index.html,2020-03-30
Trump's path to extending coronavirus guidelines was led by health experts and the scenes at one New York hospital,CNN,https://www.cnn.com/2020/03/30/politics/trump-health-experts-extend-coronavirus-guidelines/index.html,2020-03-30
President Trump's coronavirus briefings lack a crucial element: Empathy,CNN,https://www.cnn.com/2020/03/30/politics/borger-column-trump-empathy/index.html,2020-03-30
"America's terrible, growing coronavirus death toll makes Trump accept reality",CNN,https://www.cnn.com/2020/03/30/politics/donald-trump-coronavirus-easter-hospitals-deadline/index.html,2020-03-30
Trump contradicts Pompeo by downplaying foreign coronavirus disinformation campaigns,CNN,https://www.cnn.com/2020/03/30/politics/trump-foreign-disinformation-contradiction/index.html,2020-03-30
Trump says US will not pay for Prince Harry and Meghan's security.,CNN,https://www.cnn.com/2020/03/29/politics/meghan-prince-harry-trump/index.html,2020-03-30
Donald Trump's special day,CNN,https://www.cnn.com/2020/03/29/opinions/donald-trumps-special-day-opinion-weekly-column-galant/index.html,2020-03-30
'That governor is me': Gretchen Whitmer takes on Trump as coronavirus cases rise in Michigan,CNN,https://www.cnn.com/2020/03/29/politics/gretchen-whitmer-donald-trump-coronavirus/index.html,2020-03-30
Fact check: Trump falsely denies saying two things he said last week,CNN,https://www.cnn.com/2020/03/29/politics/fact-check-coronavirus-briefing/index.html,2020-04-07
"Trump strikes friendly tone on China with trade in mind, as his top officials point fingers over pandemic",CNN,https://www.cnn.com/2020/03/29/politics/trump-china-coronavirus-trade/index.html,2020-03-30
"Trump concedes US coronavirus death toll could be 100,000 or more",CNN,https://www.cnn.com/2020/03/29/politics/trump-deaths-coronavirus/index.html,2020-03-30
"US coronavirus cases top 139,000 as Trump extends social distancing guidelines until April 30",CNN,https://www.cnn.com/2020/03/29/health/us-coronavirus-wrap-sunday/index.html,2020-03-30
Trump extends federal social distancing guidelines to April 30,CNN,https://www.cnn.com/2020/03/29/politics/trump-coronavirus-press-conference/index.html,2020-03-30
"Pelosi on Trump's coronavirus response: 'As the President fiddles, people are dying'",CNN,https://www.cnn.com/2020/03/29/politics/nancy-pelosi-coronavirus-cnntv/index.html,2020-03-29
Trump's approval rating is up most among those who don't vote,CNN,https://www.cnn.com/2020/03/29/politics/trump-approval-rating-poll-of-the-week/index.html,2020-03-29
Cuomo calls Trump 'incorrect and grossly uninformed' about New York's ventilator situation as fight escalates,CNN,https://www.cnn.com/2020/03/27/politics/cuomo-trump-incorrect-and-grossly-uninformed/index.html,2020-03-28
Gavin Newsom takes new tone with Trump as he steers California during coronavirus crisis,CNN,https://www.cnn.com/2020/03/27/politics/gavin-newsom-coronavirus/index.html,2020-03-28
The 30 most outrageous lines from Donald Trump's interview with Sean Hannity,CNN,https://www.cnn.com/2020/03/27/politics/donald-trump-sean-hannity-coronavirus-china/index.html,2020-03-27
Trump rails against GOP congressman who signaled support for forcing roll-call vote on coronavirus stimulus deal,CNN,https://www.cnn.com/2020/03/27/politics/thomas-massie-donald-trump-stimulus-deal-coronavirus/index.html,2020-03-27
Dr. Anthony Fauci: Trump's desire to reopen the country by Easter is an 'aspirational projection',CNN,https://www.cnn.com/2020/03/27/politics/fauci-trump-easter-coronavirus-pandemic/index.html,2020-03-27
Trump touts great success as US becomes world's worst virus epicenter,CNN,https://www.cnn.com/2020/03/27/politics/donald-trump-coronavirus-response/index.html,2020-03-27
Fact check: Trump utters series of false and misleading claims at coronavirus briefing,CNN,https://www.cnn.com/2020/03/26/politics/fact-check-trump-coronavirus-briefing/index.html,2020-04-07
Trump administration to federal prisons: Increase home confinement for inmates to slow coronavirus spread,CNN,https://www.cnn.com/2020/03/26/politics/trump-administration-federal-prisons-coronavirus/index.html,2020-03-27
A lot of Americans like Trump's handling of crisis,CNN,https://www.cnn.com/2020/03/26/opinions/americans-like-trump-handling-crisis-opinion-jennings/index.html,2020-03-26
A restless Trump wants to end the country's isolation -- and his own,CNN,https://www.cnn.com/2020/03/24/politics/donald-trump-white-house-life-coronavirus/index.html,2020-03-26
Fact Check: Trump wildly exaggerates 1918 flu mortality rate,CNN,https://www.cnn.com/2020/03/25/politics/trump-flu-death-rate-fact-check/index.html,2020-04-07
President Trump is as popular as he's ever been right now,CNN,https://www.cnn.com/2020/03/25/politics/donald-trump-gallup-approval-polling/index.html,2020-03-25
Trump repeatedly praised China's response to coronavirus in February,CNN,https://www.cnn.com/2020/03/25/politics/trump-coronavirus-china/index.html,2020-03-25
Trump's hope for an Easter reopening clashes with coronavirus reality,CNN,https://www.cnn.com/2020/03/25/politics/donald-trump-coronavirus/index.html,2020-03-25
Trump says he's pulling back from calling novel coronavirus the 'China virus',CNN,https://www.cnn.com/2020/03/24/politics/donald-trump-pull-back-coronavirus-chinese-virus/index.html,2020-03-24
Trump quietly seeks allies' coronavirus help even as he insists 'a lot is being done',CNN,https://www.cnn.com/2020/03/24/politics/trump-seeks-allies-coronavirus-help/index.html,2020-03-24
Trump wants Easter letup as New York warns of Covid-19 crisis,CNN,https://www.cnn.com/2020/03/24/politics/what-matters-march-24/index.html,2020-03-24
Biden: Trump should 'stop talking and start listening to the medical experts',CNN,https://www.cnn.com/2020/03/24/politics/biden-trump-stop-talking/index.html,2020-03-24
Pelosi disputes Trump's calls to relax coronavirus measures to heal economy,CNN,https://www.cnn.com/2020/03/24/politics/nancy-pelosi-donald-trump-economy-shelter-in-place-coronavirus-cnntv/index.html,2020-03-24
Trump predicts 'this is going to be bad' but vows to reopen America,CNN,https://www.cnn.com/2020/03/24/politics/donald-trump-coronavirus-strategy/index.html,2020-03-24
Trump is holding his own in coronavirus polling,CNN,https://www.cnn.com/2020/03/24/politics/trump-approval-rating-coronavirus/index.html,2020-03-24
Trump can't be trusted to make this decision,CNN,https://www.cnn.com/2020/03/24/opinions/coronavirus-trump-decision-frida-ghitis-opinion/index.html,2020-03-24
"First lady Melania Trump tests negative for coronavirus, White House says",CNN,https://www.cnn.com/2020/03/23/politics/melania-trump-first-lady-coronavirus-test-negative/index.html,2020-03-24
Trump says spread of coronavirus not the fault of the Asian American community,CNN,https://www.cnn.com/2020/03/23/politics/donald-trump-coronavirus-asian-american-community/index.html,2020-03-24
Nigeria records chloroquine poisoning after Trump endorses it for coronavirus treatment,CNN,https://www.cnn.com/2020/03/23/africa/chloroquine-trump-nigeria-intl/index.html,2020-04-07
Trump's painful dilemma,CNN,https://www.cnn.com/2020/03/23/opinions/trumps-painful-dilemma-opinion-bergen/index.html,2020-03-23
Appeals court won't revisit ruling saying Trump can't block Twitter users,CNN,https://www.cnn.com/2020/03/23/politics/trump-twitter-block/index.html,2020-03-23
Democratic group launches $6 million campaign attacking Trump on coronavirus response,CNN,https://www.cnn.com/2020/03/22/politics/priorities-usa-trump-coronavirus-attack-ads/index.html,2020-03-23
Democratic senators move to force Trump's hand to ramp up medical equipment production,CNN,https://www.cnn.com/2020/03/22/politics/democratic-senators-defense-production-act/index.html,2020-03-23
Trump made 33 false claims about the coronavirus crisis in the first two weeks of March,CNN,https://www.cnn.com/2020/03/22/politics/fact-check-trump-coronavirus-false-claims-march/index.html,2020-04-07
Cuomo pleads for Trump to nationalize coronavirus response as governors describe fight for medical supplies,CNN,https://www.cnn.com/2020/03/22/politics/andrew-cuomo-coronavirus-federal-government/index.html,2020-03-22
Congress' Asian Pacific American caucus chair: It's dangerous for Trump to call coronavirus 'the Chinese virus',CNN,https://www.cnn.com/2020/03/21/politics/judy-chu-coronavirus-trump-china/index.html,2020-03-21
Trump on China: 'I wish they'd told us earlier' about coronavirus,CNN,https://www.cnn.com/2020/03/21/politics/trump-china-told-us-coronavirus/index.html,2020-03-21
Donald Trump starts 2020 in the worst polling position since Harry Truman,CNN,https://www.cnn.com/2020/03/21/politics/trump-vs-biden-poll-of-the-week/index.html,2020-03-21
Trump will be judged on one thing now -- and it won't be impeachment,CNN,https://www.cnn.com/2020/03/21/politics/race-for-the-white-house-trump-impeachment-ford-carter-gore-bush/index.html,2020-03-22
"As Trump's leadership is tested, he turns to states and the private sector",CNN,https://www.cnn.com/2020/03/21/politics/donald-trump-leadership-coronavirus/index.html,2020-03-21
Washington Post: US intelligence warned Trump in January and February as he dismissed coronavirus threat,CNN,https://www.cnn.com/2020/03/20/politics/us-intelligence-reports-trump-coronavirus/index.html,2020-03-21
Here's Donald Trump's angry response when asked what he would tell scared Americans,CNN,https://www.cnn.com/2020/03/20/politics/peter-alexander-donald-trump-coronavirus/index.html,2020-03-21
"Yes, of course Donald Trump is calling coronavirus the 'China virus' for political reasons",CNN,https://www.cnn.com/2020/03/20/politics/donald-trump-china-virus-coronavirus/index.html,2020-03-20
Biden to Trump on coronavirus: 'Stop saying false things that will make you sound like a hero',CNN,https://www.cnn.com/2020/03/20/politics/joe-biden-trump-coronavirus-response/index.html,2020-03-20
Trump says Defense Production Act in 'high gear' after saying he'd only use in worst case scenario,CNN,https://www.cnn.com/2020/03/20/politics/trump-defense-production-act/index.html,2020-03-20
Trump administration asking states to delay release of unemployment numbers,CNN,https://www.cnn.com/2020/03/20/politics/labor-department-states-unemployment-numbers-coronavirus/index.html,2020-03-20
Trump allows borrowers to suspend student loan payments for two months,CNN,https://www.cnn.com/2020/03/20/politics/student-loan-payments-suspend-coronavirus/index.html,2020-03-20
"Ivanka Trump tested negative for coronavirus and is back at work, source says",CNN,https://www.cnn.com/2020/03/20/politics/ivanka-trump-coronavirus-test-work/index.html,2020-03-20
Trump peddles unsubstantiated hope in dark times,CNN,https://www.cnn.com/2020/03/20/politics/donald-trump-coronavirus-false-hope/index.html,2020-03-20
Just wait for Trump to demand that China pay for the pandemic,CNN,https://www.cnn.com/2020/03/19/world/meanwhile-in-america-march-19-intl/index.html,2020-03-20
Trump's complete failure of imagination is costing America lives and treasure,CNN,https://www.cnn.com/2020/03/19/opinions/donald-trump-pandemic-failure-imagination-hill/index.html,2020-03-20
