Trump administration rejects CDC guidance on reopening US amid coronavirus,CNN,https://www.cnn.com/2020/05/07/politics/cdc-guidance-coronavirus-reopen-america/index.html,2020-05-08
One of Trump's personal valets has tested positive for coronavirus,CNN,https://www.cnn.com/2020/05/07/politics/trump-valet-tests-positive-covid-19/index.html,2020-05-07
Trump campaign launching $10 million effort attacking Joe Biden,CNN,https://www.cnn.com/2020/05/07/politics/trump-campaign-negative-ad/index.html,2020-05-07
Senate fails to override Trump veto of Iran War Powers resolution,CNN,https://www.cnn.com/2020/05/07/politics/senate-iran-war-powers-resolution/index.html,2020-05-07
"Trump, stop comparing yourself to Lincoln",CNN,https://www.cnn.com/2020/05/05/opinions/trump-abraham-lincoln-comparison-meltzer-mensch/index.html,2020-05-07
Lincoln Project says it raised more than $1.4 million after Trump attacks,CNN,https://www.cnn.com/2020/05/07/politics/lincoln-project-trump-ad/index.html,2020-05-07
Trump asks Supreme Court to block release of Mueller grand jury information,CNN,https://www.cnn.com/2020/05/07/politics/mueller-documents-trump-grand-jury-supreme-court/index.html,2020-05-07
Trump economy faces long-term disaster as jobs data looms,CNN,https://www.cnn.com/2020/05/07/politics/donald-trump-coronavirus-economy/index.html,2020-05-07
Melania Trump's 'Be Best' falls short of goals at 2nd year mark,CNN,https://www.cnn.com/2020/05/07/politics/melania-trump-be-best-anniversary/index.html,2020-05-07
Trump vetoes Iran War Powers resolution,CNN,https://www.cnn.com/2020/05/06/politics/trump-veto-iran-war-powers/index.html,2020-05-07
"Obamacare, Trump and the Supreme Court, explained",CNN,https://www.cnn.com/2020/05/06/politics/trump-obamacare-lawsuit/index.html,2020-05-07
Trump contradicts nurse he's honoring over PPE availability,CNN,https://www.cnn.com/2020/05/06/politics/donald-trump-nurse-ppe-coronavirus/index.html,2020-05-07
Trump pivots hard away from fight against unvanquished pandemic,CNN,https://www.cnn.com/2020/05/06/politics/donald-trump-coronavirus/index.html,2020-05-06
This could be Trump's worst mistake ever,CNN,https://www.cnn.com/2020/05/05/opinions/coronavirus-trump-worst-mistake-bergen/index.html,2020-05-06
Restless Trump escapes White House but not the pandemic,CNN,https://www.cnn.com/2020/05/05/politics/trump-arizona-trip/index.html,2020-05-06
Trump's support for Michigan protesters sends a dangerous message,CNN,https://www.cnn.com/2020/05/05/opinions/michigan-militia-coronavirus-protests-soifer/index.html,2020-05-06
"Wait, Donald Trump's approval is up again?",CNN,https://www.cnn.com/2020/05/05/politics/donald-trump-approval-rating-coronavirus/index.html,2020-05-06
Trump is an outsider -- even among former presidents,CNN,https://www.cnn.com/2020/05/04/opinions/president-george-w-bush-donald-j-trump-brotherhood-unity-brower/index.html,2020-05-05
American Bar Association now rates Trump nominee for powerful court seat as 'well-qualified',CNN,https://www.cnn.com/2020/05/05/politics/walker-american-bar-association/index.html,2020-05-05
Trump's grievances with little known group put their attacks in the spotlight,CNN,https://www.cnn.com/2020/05/05/politics/what-is-lincoln-project/index.html,2020-05-06
Donald Trump just broke the most basic rule of politics,CNN,https://www.cnn.com/2020/05/05/politics/lincoln-project-ad-donald-trump/index.html,2020-05-05
Anthony Fauci just crushed Donald Trump's theory on the origins of the coronavirus,CNN,https://www.cnn.com/2020/05/05/politics/fauci-trump-coronavirus-wuhan-lab/index.html,2020-05-05
That should worry Trump.,CNN,https://www.cnn.com/2020/05/05/politics/trump-2020-coronavirus-economy-analysis/index.html,2020-05-05
Trump can't make America normal again -- no matter how hard he tries,CNN,https://www.cnn.com/2020/05/05/politics/gloria-borger-analysis-trump-rallies/index.html,2020-05-05
Why Trump's shadow over the race for Senate control is so long,CNN,https://www.cnn.com/2020/05/05/politics/2020-election-senate-control-trump/index.html,2020-05-05
New York Times: Interior secretary relaxed rules so Trump could hold Fox News interview at Lincoln Memorial,CNN,https://www.cnn.com/2020/05/04/politics/david-bernhardt-lincoln-memorial-trump-town-hall/index.html,2020-05-05
Timeline: Tracking Trump's rising coronavirus death toll estimates,CNN,https://www.cnn.com/2020/05/04/politics/trump-rising-coronavirus-death-estimates/index.html,2020-05-04
Trump attacks Bush after 43rd president offers message of unity,CNN,https://www.cnn.com/2020/05/03/politics/george-w-bush-coronavirus-partisanship-trump/index.html,2020-05-04
The 45 most shocking lines from Donald Trump's Lincoln Memorial Fox town hall,CNN,https://www.cnn.com/2020/05/04/politics/donald-trump-fox-lincoln-memorial/index.html,2020-05-04
Trump claims intelligence officials did not raise coronavirus until late January,CNN,https://www.cnn.com/2020/05/03/politics/trump-coronavirus-us-intelligence/index.html,2020-05-04
Trump again shifts estimated US coronavirus death toll,CNN,https://www.cnn.com/2020/05/03/politics/trump-coronavirus-death-estimates/index.html,2020-05-04
How Trump has broken the polls,CNN,https://www.cnn.com/2020/05/03/politics/trump-polling/index.html,2020-05-04
President Trump's reelection strategy is taking shape,CNN,https://www.cnn.com/2020/05/02/opinions/president-trumps-reelection-strategy-is-taking-shape-zelizer/index.html,2020-05-03
"Trump says he's 'glad to see' Kim Jong Un 'is back, and well!'",CNN,https://www.cnn.com/2020/05/02/politics/trump-kim-jong-un-response/index.html,2020-05-03
McConnell and Pelosi 'respectfully decline' Trump admin offer to supply Covid-19 tests ahead of senators' return to DC,CNN,https://www.cnn.com/2020/05/02/politics/senate-coronavirus-testing-hhs-alex-azar/index.html,2020-05-02
Trump names his pick for HHS inspector general after criticizing acting official over coronavirus report,CNN,https://www.cnn.com/2020/05/02/politics/hhs-inspector-general-trump-nominee-jason-weida/index.html,2020-05-02
Trump's national security adviser out of sight in coronavirus response,CNN,https://www.cnn.com/2020/05/02/politics/robert-obrien-national-security-adviser-coronavirus-out-of-sight/index.html,2020-05-02
Trump is fighting a public health crisis with denial and self-promotion,CNN,https://www.cnn.com/2020/05/01/opinions/trump-coronavirus-denial-and-self-promotion-ghitis/index.html,2020-05-02
"Despite Trump executive order, meat-processing plants struggle to stay open",CNN,https://www.cnn.com/2020/05/01/politics/executive-order-meat-processing-plants-open/index.html,2020-05-01
Trump escapes Washington isolation for Camp David,CNN,https://www.cnn.com/2020/05/01/politics/trump-camp-david-coronavirus/index.html,2020-05-01
"Trump tweets support for Michigan protesters, some of whom were armed, as 2020 stress mounts",CNN,https://www.cnn.com/2020/05/01/politics/donald-trump-michigan-gretchen-whitmer-protests/index.html,2020-05-01
Trump administration gets 10-day delay to turn over Mueller docs to House,CNN,https://www.cnn.com/2020/05/01/politics/mueller-grand-jury-documents/index.html,2020-05-01
Trump on handling of coronavirus: 'I think we've done a great job',CNN,https://www.cnn.com/2020/05/01/world/meanwhile-in-america-may-1/index.html,2020-05-01
Trump contradicts US intel community by claiming he's seen evidence coronavirus originated in Chinese lab,CNN,https://www.cnn.com/2020/04/30/politics/trump-intelligence-community-china-coronavirus-origins/index.html,2020-05-01
Separating fact from fiction as Trump builds a rationale to pardon Michael Flynn,CNN,https://www.cnn.com/2020/04/30/politics/flynn-trump-conspiracy-theories-pardon/index.html,2020-05-01
Trump's strongman diplomacy is coming apart under Covid-19,CNN,https://www.cnn.com/2020/04/30/opinions/trumps-strongman-diplomacy-is-coming-apart-coronavirus-andelman/index.html,2020-04-30
Can Trump make good on his vaccine promise?,CNN,https://www.cnn.com/2020/04/30/politics/donald-trump-coronavirus-vaccine/index.html,2020-04-30
Fact check: Hilton CEO shatters Trump's testing conspiracy theory while sitting beside him,CNN,https://www.cnn.com/2020/04/30/politics/fact-check-trump-testing-conspiracy-hilton-nassetta/index.html,2020-04-30
Trump renews threats to withhold federal funds from sanctuary cities amid pandemic,CNN,https://www.cnn.com/2020/04/30/politics/trump-sanctuary-city-coronavirus/index.html,2020-04-30
Trump administration draws up plans to punish China over coronavirus outbreak,CNN,https://www.cnn.com/2020/04/30/politics/us-china-coronavirus-diplomacy-intelligence-donald-trump/index.html,2020-04-30
Trump calls newly released UFO footage 'a hell of a video',CNN,https://www.cnn.com/2020/04/30/politics/donald-trump-ufo-videos-response/index.html,2020-04-30
Trump erupts at campaign manager as reelection stress overflows,CNN,https://www.cnn.com/2020/04/29/politics/donald-trump-brad-parscale-campaign-coronavirus/index.html,2020-04-30
Trump's 2020 attack strategy against Biden is straight from his 2016 playbook,CNN,https://www.cnn.com/2020/04/30/politics/2020-election-trump-campaign-biden-attacks/index.html,2020-04-30
House says it wants to keep investigating Trump for possible impeachable offenses,CNN,https://www.cnn.com/2020/04/29/politics/mueller-grand-jury-house-impeachable/index.html,2020-04-29
Trump campaign launches digital ad featuring Democratic governors praising the President's coronavirus response,CNN,https://www.cnn.com/2020/04/29/politics/trump-campaign-digital-ad-coronavirus/index.html,2020-04-29
Trump still seems to not understand how bad the coronavirus crisis is,CNN,https://www.cnn.com/2020/04/29/politics/donald-trump-coronavirus-politics-pence/index.html,2020-04-29
Pentagon restarts some domestic building projects that lost funding to Trump's wall,CNN,https://www.cnn.com/2020/04/28/politics/pentagon-restarts-building-projects/index.html,2020-04-28
Judges consider when to play referee in age of Trump,CNN,https://www.cnn.com/2020/04/28/politics/judges-trump-democrats-constitution-referee/index.html,2020-04-28
Troops who suffered traumatic brain injuries dismissed by Trump expected to receive Purple Hearts,CNN,https://www.cnn.com/2020/04/28/politics/traumatic-brain-injuries-purple-hearts/index.html,2020-04-28
Trump and Florida's DeSantis talk reopening plans and share mutual congratulations,CNN,https://www.cnn.com/2020/04/28/politics/donald-trump-ron-desantis-florida/index.html,2020-04-28
Jeff Flake: A 'sound defeat' of Trump in the 2020 election would be better for the Republican Party,CNN,https://www.cnn.com/2020/04/28/politics/jeff-flake-donald-trump-republican-party/index.html,2020-04-28
Washington Post: Trump downplayed coronavirus despite more than a dozen warnings in daily briefings,CNN,https://www.cnn.com/2020/04/27/politics/trump-presidential-daily-briefings-coronavirus/index.html,2020-04-28
House Foreign Affairs Committee launches inquiry into Trump's decision to suspended World Health Organization funding,CNN,https://www.cnn.com/2020/04/27/politics/hfac-who-state-department-letter/index.html,2020-04-27
Fact check: Trump litters his weekend tweetstorm with bizarre false claims,CNN,https://www.cnn.com/2020/04/27/politics/fact-check-trump-tweetstorm-birx-noble/index.html,2020-04-27
Supreme Court asks for additional briefings in Trump finances cases,CNN,https://www.cnn.com/2020/04/27/politics/supreme-court-donald-trump-congress-financial-documents/index.html,2020-04-27
Why Trump failed his nation,CNN,https://www.cnn.com/2020/04/27/opinions/scorpion-frog-trump-nature-opinion-axelrod/index.html,2020-04-27
Trump's angry words to Georgia governor reverberate in state capitals as governors move to reopen states,CNN,https://www.cnn.com/2020/04/27/politics/trump-kemp-georgia-governors-reopen/index.html,2020-04-27
Trump's stage is caving in.,CNN,https://www.cnn.com/2020/04/27/politics/borger-column-trump-doctors/index.html,2020-04-27
Trump is driving Birx to a tough spot.,CNN,https://www.cnn.com/2020/04/27/politics/donald-trump-deborah-birx-disinfectant-testing-coronavirus/index.html,2020-04-27
An aggrieved Trump blames press for furor over disinfectant comments as Birx defends him,CNN,https://www.cnn.com/2020/04/26/politics/trump-briefings-media-blame-disinfectant-comments/index.html,2020-04-27
Trump denies he is about to fire Health and Human Services Secretary Alex Azar,CNN,https://www.cnn.com/2020/04/26/politics/alex-azar-trump-hhs-secretary/index.html,2020-04-27
Trump's outrageous suggestion comes with a dark history,CNN,https://www.cnn.com/2020/04/26/opinions/disinfectant-has-a-dark-medical-history-le-zotte-steere-williams/index.html,2020-04-27
Republicans are stuck with Donald Trump,CNN,https://www.cnn.com/2020/04/26/politics/us-election-2020-week-ahead/index.html,2020-04-27
Dangerous collisions in Trumpland,CNN,https://www.cnn.com/2020/04/26/opinions/dangerous-collisions-in-trumpland-opinion-weekly-column/index.html,2020-04-26
Trump's likeability deficit could cost him in 2020,CNN,https://www.cnn.com/2020/04/25/politics/2020-election-trump-favorability/index.html,2020-04-26
Why Donald Trump can't just postpone the November election,CNN,https://www.cnn.com/2020/04/24/politics/donald-trump-joe-biden-november-election-postpone/index.html,2020-04-25
Biden says he thinks Trump will try to delay the presidential election,CNN,https://www.cnn.com/2020/04/24/politics/joe-biden-trump-delay-presidential-election/index.html,2020-04-25
Trump administration plans to go to the Supreme Court in Mueller grand jury document dispute,CNN,https://www.cnn.com/2020/04/24/politics/mueller-grand-jury-supreme-court/index.html,2020-04-24
Fact check: Trump lies that he was being 'sarcastic' when he talked about injecting disinfectant,CNN,https://www.cnn.com/2020/04/24/politics/fact-check-trump-disinfectant-sarcastic/index.html,2020-04-25
Trump can't stop putting his top public health officials in tough spots,CNN,https://www.cnn.com/2020/04/24/politics/donald-trump-doctors-science-coronavirus/index.html,2020-04-25
Doctors reject Trump's dangerous suggestion to use disinfectant as a coronavirus treatment,CNN,https://www.cnn.com/2020/04/24/politics/doctors-respond-trump-disinfectant-injection-coronavirus/index.html,2020-04-24
Who will be held accountable for Trump's nonsensical ideas?,CNN,https://www.cnn.com/2020/04/23/opinions/trump-nonsensical-ideas-rick-bright-covid-ghitis/index.html,2020-04-24
Donald Trump's incredibly dangerous musings on disinfectants,CNN,https://www.cnn.com/2020/04/24/politics/donald-trump-disinfectant-uv-light/index.html,2020-04-24
FDA warns of serious side effects from drugs touted by Trump to treat coronavirus,CNN,https://www.cnn.com/2020/04/24/health/fda-warns-against-chloroquine-to-treat-covid/index.html,2020-04-24
The key area where Trump is trouncing Biden,CNN,https://www.cnn.com/2020/04/23/opinions/trump-biden-political-attack-ads-wierson-honan/index.html,2020-04-24
"Trump mum on hydroxychloroquine as early trials falter, but sick Americans still taking 'desperate measures' to fill prescriptions",CNN,https://www.cnn.com/2020/04/22/politics/trump-hydroxychloroquine-shortages-black-market-coronavirus/index.html,2020-04-24
Major health groups and charities urge Trump to reverse World Health Organization funding decision,CNN,https://www.cnn.com/2020/04/24/politics/trump-who-funding-letter/index.html,2020-04-24
How the Supreme Court has enabled Trump on immigration,CNN,https://www.cnn.com/2020/04/24/politics/trump-supreme-court-immigration-daca-green-cards/index.html,2020-04-24
"Trump, ever the salesman, is peddling dangerous cures for coronavirus",CNN,https://www.cnn.com/2020/04/24/politics/donald-trump-coronavirus-disinfectant-sunlight-science/index.html,2020-04-24
Preliminary study results suggest the drug Trump touted doesn't work for very sick coronavirus patients,CNN,https://www.cnn.com/2020/04/23/health/hydroxychloroquine-new-york-coronavirus-study/index.html,2020-04-24
Trump disagrees with Fauci on US testing capacity,CNN,https://www.cnn.com/2020/04/23/politics/fauci-testing-capacity-not-overly-confident/index.html,2020-04-23
Trump disregards science as chaos overtakes coronavirus response,CNN,https://www.cnn.com/2020/04/23/politics/donald-trump-science-coronavirus/index.html,2020-04-23
"Fact check: Trump makes false claims about governors not wanting tests, and repeats errors about Pelosi and Michelle Obama",CNN,https://www.cnn.com/2020/04/22/politics/april-22-wednesday-coronavirus-briefing-fact-check/index.html,2020-04-23
Trump's standing in battleground states may be slipping,CNN,https://www.cnn.com/2020/04/23/politics/2020-polls-battleground-states/index.html,2020-04-23
Trump says he 'strongly' disagreed with move to reopen Georgia -- contradicting source who said he agreed with it,CNN,https://www.cnn.com/2020/04/22/politics/trump-pence-georgia-governor-brian-kemp/index.html,2020-04-23
China is becoming a defining issue in the clash between Biden and Trump,CNN,https://www.cnn.com/2020/04/22/world/meanwhile-in-america-april-23-intl/index.html,2020-04-23
Some ex-felons excluded from small business relief in spite of Trump's criminal justice reform platform,CNN,https://www.cnn.com/2020/04/22/politics/trump-ex-felons-small-business-relief/index.html,2020-04-23
Trump on Twitter tells US Navy to 'shoot down and destroy' Iranian boats that harass US ships,CNN,https://www.cnn.com/2020/04/22/politics/trump-us-navy-iranian-ships-tweet/index.html,2020-04-23
Biden memo urges surrogates to fault Trump 'for unimaginable pain and suffering' due to coronavirus response,CNN,https://www.cnn.com/2020/04/22/politics/joe-biden-memo-trump-coronavirus/index.html,2020-04-22
The Senate just proved Donald Trump wrong -- again -- on Russian interference in 2016,CNN,https://www.cnn.com/2020/04/22/politics/senate-intelligence-committee-donald-trump-russia/index.html,2020-04-22
The long-dead muse inspiring Trump's daily briefing show,CNN,https://www.cnn.com/2020/04/21/opinions/trump-briefings-muse-dantonio/index.html,2020-04-22
Trump's moves on immigration reveal his true motives,CNN,https://www.cnn.com/2020/04/22/opinions/trump-immigration-tweet-denigrates-america-zakaria/index.html,2020-04-22
NIH Covid-19 treatment guidelines warn against drug combo pushed by Trump,CNN,https://www.cnn.com/2020/04/21/health/nih-covid-19-treatment-guidelines/index.html,2020-04-22
Trump and Biden launch battle over China that could define 2020 election,CNN,https://www.cnn.com/2020/04/21/politics/trump-biden-china-2020/index.html,2020-04-22
Bipartisan Senate report backs intel community assessment that Russia interfered to help Trump in 2016 election,CNN,https://www.cnn.com/2020/04/21/politics/senate-report-russia-interference/index.html,2020-04-21
Trump says he doesn't know whether Kim Jong Un is ill but wishes him luck,CNN,https://www.cnn.com/2020/04/21/politics/trump-kim-jong-un-north-korea/index.html,2020-04-21
Trump claims he will temporarily suspend immigration into US due to coronavirus fears,CNN,https://www.cnn.com/2020/04/20/politics/donald-trump-immigration-halt-coronavirus/index.html,2020-04-21
Georgia's reopening is a high-stakes public health bet -- and will likely please Trump,CNN,https://www.cnn.com/2020/04/21/politics/donald-trump-georgia-coronavirus-economy/index.html,2020-04-21
Trump's 2016 messaging mojo is failing him now,CNN,https://www.cnn.com/2020/04/20/opinions/trumps-2016-messaging-failure-coronavirus-lockhart/index.html,2020-04-21
Trump is weakening America's immune system,CNN,https://www.cnn.com/2020/04/20/opinions/trump-institutions-autocrats-kasparov/index.html,2020-04-21
Trump targets Hogan in attempt to flip testing criticism back on governors,CNN,https://www.cnn.com/2020/04/20/politics/mike-pence-governors-call-coronavirus-testing-supplies/index.html,2020-04-21
"Fauci strikes different tone on testing than Trump, calls for 'partnership' between states and feds",CNN,https://www.cnn.com/2020/04/20/politics/anthony-fauci-state-and-federal-coronavirus-tests/index.html,2020-04-20
How Trump lost the public on coronavirus,CNN,https://www.cnn.com/2020/04/19/politics/us-election-2020-week-ahead/index.html,2020-04-20
Washington Post: Trump administration official in charge of coronavirus testing was forced out of vaccine research job,CNN,https://www.cnn.com/2020/04/20/politics/brett-giroir-coronavirus-vaccine/index.html,2020-04-20
Trump shocks in time of crisis with his standard approach,CNN,https://www.cnn.com/2020/04/20/politics/trump-coronavirus-all-about-him/index.html,2020-04-20
"Trump won't say whether he will pardon Manafort and Stone, calls FBI investigators 'human scum'",CNN,https://www.cnn.com/2020/04/19/politics/trump-manafort-stone-pardons/index.html,2020-04-20
Trump counters governors' pleas for help: 'Testing is a local thing',CNN,https://www.cnn.com/2020/04/19/politics/trump-briefing-sunday-april-19/index.html,2020-04-20
Governors dispute Trump's claim that there's enough coronavirus testing,CNN,https://www.cnn.com/2020/04/19/politics/trump-governors-coronavirus-testing/index.html,2020-04-19
Donald Trump's stunning flip-flops,CNN,https://www.cnn.com/2020/04/19/opinions/donald-trumps-stunning-flip-flops-opinion-column-galant/index.html,2020-04-19
"Fact check: Trump's Saturday coronavirus briefing was littered with false claims, old and new",CNN,https://www.cnn.com/2020/04/18/politics/fact-check-coronavirus-briefing-april-18/index.html,2020-04-19
Trump is frustrated and 'chomping at the bit' to reopen America and the economy,CNN,https://www.cnn.com/2020/04/18/politics/trump-economy-coronavirus/index.html,2020-04-19
Trump is playing with fire,CNN,https://www.cnn.com/2020/04/18/opinions/trump-is-playing-with-fire-ghitis/index.html,2020-04-18
'Nothing to worry about' and 'it's being contained': How Trump officials downplayed the coronavirus,CNN,https://www.cnn.com/2020/04/18/politics/kfile-trump-officials-coronavirus/index.html,2020-04-18
Putin leverages coronavirus chaos to make a direct play to Trump,CNN,https://www.cnn.com/2020/04/18/politics/trump-putin-unprecedented-contacts/index.html,2020-04-18
Trump's devious -- and brilliant -- coronavirus election strategy,CNN,https://www.cnn.com/2020/04/17/opinions/trump-strategy-to-shift-blame-on-coronavirus-and-economy-lockhart/index.html,2020-04-18
"Trump lashes out at Democrats, seeking to pass the blame for economic pain",CNN,https://www.cnn.com/2020/04/17/politics/donald-trump-liberate-michigan-minnesota-virginia/index.html,2020-04-18
Trump tweets warnings at governors who are taking his own advice.,CNN,https://www.cnn.com/2020/04/17/politics/trump-tweets-governors-borger-column/index.html,2020-04-17
Feds charge doctor who cited Trump to push hydroxychloroquine 'miracle cure',CNN,https://www.cnn.com/2020/04/17/us/doctor-charged-hydroxychloroquine-trump/index.html,2020-04-17
Fact check: Trump wrongly declares some states don't have 'any problem' with coronavirus,CNN,https://www.cnn.com/2020/04/16/politics/fact-check-trump-april-16/index.html,2020-04-17
The Trump polling bump is officially over,CNN,https://www.cnn.com/2020/04/17/politics/donald-trump-polls-coronavirus/index.html,2020-04-17
Trump takes a victory lap for a crisis that isn't over yet,CNN,https://www.cnn.com/2020/04/17/politics/donald-trump-coronavirus-economy-politics/index.html,2020-04-17
Governors should ignore Trump's advice until widespread testing and effective contact tracing are ready,CNN,https://www.cnn.com/2020/04/16/opinions/trump-governors-covid-19-reopen-america-redlener/index.html,2020-04-17
Trump's big show of opening the economy will hide the real story,CNN,https://www.cnn.com/2020/04/16/politics/donald-trump-economy-coronavirus-pain/index.html,2020-04-16
"Fact check: Trump repeats false claim he has power over state coronavirus restrictions, threatens to shut down Congress",CNN,https://www.cnn.com/2020/04/15/politics/fact-check-coronavirus-briefing-april-15/index.html,2020-04-16
Trump threatens to invoke never-used constitutional authority to adjourn Congress and push nominees through,CNN,https://www.cnn.com/2020/04/15/politics/donald-trump-senate-adjourn-constitution/index.html,2020-04-16
Trump's disastrous response to Covid-19 demands investigation,CNN,https://www.cnn.com/2020/04/15/opinions/trump-admin-coronavirus-investigation-opinion-sachs/index.html,2020-04-15
Trump poised to unveil new federal coronavirus guidelines Thursday,CNN,https://www.cnn.com/2020/04/15/politics/donald-trump-guidelines-coronavirus/index.html,2020-04-15
Jimmy Carter 'distressed' by Trump's decision to withhold WHO funding,CNN,https://www.cnn.com/2020/04/15/politics/carter-world-health-organization-funding/index.html,2020-04-15
Trump is giving you your money and putting his name on it,CNN,https://www.cnn.com/2020/04/15/opinions/covid-19-stimulus-check-trump-name-dantonio/index.html,2020-04-15
"WHO says it regrets Trump's decision to halt funding, but remains focused on coronavirus response",CNN,https://www.cnn.com/2020/04/15/politics/who-responds-trump-stop-funding/index.html,2020-04-15
Trump's name will be added to stimulus checks,CNN,https://www.cnn.com/2020/04/14/politics/trump-name-checks-coronavirus/index.html,2020-04-15
Fact check: Trump denies saying another thing he said and makes more false claims at coronavirus briefing,CNN,https://www.cnn.com/2020/04/14/politics/fact-check-trump-april-14/index.html,2020-04-15
Trump administration's preparations for WHO funding cuts tee up battle with Congress,CNN,https://www.cnn.com/2020/04/15/politics/trump-who-funding-congress/index.html,2020-04-15
Trump retreats from absolute authority claim as he deflects blame for coronavirus crisis to WHO,CNN,https://www.cnn.com/2020/04/15/politics/trump-coronavirus-crisis/index.html,2020-04-15
Illinois governor says he's 'given up' on coronavirus help from the Trump administration,CNN,https://www.cnn.com/2020/04/14/politics/pritzker-trump-coronavirus-help-cnntv/index.html,2020-04-15
